{
  "t": "hello",
  "protocol": "ash-link/2",
  "hand": {
    "kind": "computer",
    "name": "Phone",
    "version": "0.4.0",
    "platform": "android-35",
    "public_key": "MFkwEwYHKoZIzj0CAQ"
  },
  "sig": "c2ln",
  "channels": {
    "device": {},
    "agent": {
      "runtimes": [
        {
          "id": "codex"
        }
      ]
    }
  }
}
